product_id,product_name,category,price,rating,availability,number_of_reviews,product_url,scrape_date
439,Dress Your Family in Corduroy and Denim,Books,43.68,Three,In stock,,https://books.toscrape.com/catalogue/dress-your-family-in-corduroy-and-denim_562/index.html,2025-12-18
440,Don't Forget Steven,Books,33.23,One,In stock,,https://books.toscrape.com/catalogue/dont-forget-steven_561/index.html,2025-12-18
441,Chernobyl 01:23:40: The Incredible True Story of the World's Worst Nuclear Disaster,Books,35.92,Two,In stock,,https://books.toscrape.com/catalogue/chernobyl-012340-the-incredible-true-story-of-the-worlds-worst-nuclear-disaster_560/index.html,2025-12-18
442,Art and Fear: Observations on the Perils (and Rewards) of Artmaking,Books,48.63,Four,In stock,,https://books.toscrape.com/catalogue/art-and-fear-observations-on-the-perils-and-rewards-of-artmaking_559/index.html,2025-12-18
443,A Shard of Ice (The Black Symphony Saga #1),Books,56.63,Three,In stock,,https://books.toscrape.com/catalogue/a-shard-of-ice-the-black-symphony-saga-1_558/index.html,2025-12-18
444,A Hero's Curse (The Unseen Chronicles #1),Books,50.49,Three,In stock,,https://books.toscrape.com/catalogue/a-heros-curse-the-unseen-chronicles-1_557/index.html,2025-12-18
445,23 Degrees South: A Tropical Tale of Changing Whether...,Books,35.79,Two,In stock,,https://books.toscrape.com/catalogue/23-degrees-south-a-tropical-tale-of-changing-whether_556/index.html,2025-12-18
446,"Zero to One: Notes on Startups, or How to Build the Future",Books,34.06,Three,In stock,,https://books.toscrape.com/catalogue/zero-to-one-notes-on-startups-or-how-to-build-the-future_555/index.html,2025-12-18
447,Why Not Me?,Books,17.76,One,In stock,,https://books.toscrape.com/catalogue/why-not-me_554/index.html,2025-12-18
448,When Breath Becomes Air,Books,39.36,Two,In stock,,https://books.toscrape.com/catalogue/when-breath-becomes-air_553/index.html,2025-12-18
449,Vagabonding: An Uncommon Guide to the Art of Long-Term World Travel,Books,36.94,Two,In stock,,https://books.toscrape.com/catalogue/vagabonding-an-uncommon-guide-to-the-art-of-long-term-world-travel_552/index.html,2025-12-18
450,The Unlikely Pilgrimage of Harold Fry (Harold Fry #1),Books,43.62,Five,In stock,,https://books.toscrape.com/catalogue/the-unlikely-pilgrimage-of-harold-fry-harold-fry-1_551/index.html,2025-12-18
451,The New Drawing on the Right Side of the Brain,Books,43.02,Three,In stock,,https://books.toscrape.com/catalogue/the-new-drawing-on-the-right-side-of-the-brain_550/index.html,2025-12-18
452,"The Midnight Assassin: Panic, Scandal, and the Hunt for America's First Serial Killer",Books,28.45,Four,In stock,,https://books.toscrape.com/catalogue/the-midnight-assassin-panic-scandal-and-the-hunt-for-americas-first-serial-killer_549/index.html,2025-12-18
453,The Martian (The Martian #1),Books,41.39,Two,In stock,,https://books.toscrape.com/catalogue/the-martian-the-martian-1_548/index.html,2025-12-18
454,The High Mountains of Portugal,Books,51.15,One,In stock,,https://books.toscrape.com/catalogue/the-high-mountains-of-portugal_547/index.html,2025-12-18
455,The Grownup,Books,35.88,One,In stock,,https://books.toscrape.com/catalogue/the-grownup_546/index.html,2025-12-18
456,The E-Myth Revisited: Why Most Small Businesses Don't Work and What to Do About It,Books,36.91,One,In stock,,https://books.toscrape.com/catalogue/the-e-myth-revisited-why-most-small-businesses-dont-work-and-what-to-do-about-it_545/index.html,2025-12-18
457,South of Sunshine,Books,28.93,One,In stock,,https://books.toscrape.com/catalogue/south-of-sunshine_544/index.html,2025-12-18
458,Smarter Faster Better: The Secrets of Being Productive in Life and Business,Books,38.89,Five,In stock,,https://books.toscrape.com/catalogue/smarter-faster-better-the-secrets-of-being-productive-in-life-and-business_543/index.html,2025-12-18
459,Silence in the Dark (Logan Point #4),Books,58.33,Three,In stock,,https://books.toscrape.com/catalogue/silence-in-the-dark-logan-point-4_542/index.html,2025-12-18
460,Shadows of the Past (Logan Point #1),Books,39.67,Five,In stock,,https://books.toscrape.com/catalogue/shadows-of-the-past-logan-point-1_541/index.html,2025-12-18
461,Roller Girl,Books,14.1,Five,In stock,,https://books.toscrape.com/catalogue/roller-girl_540/index.html,2025-12-18
462,Rising Strong,Books,21.82,Three,In stock,,https://books.toscrape.com/catalogue/rising-strong_539/index.html,2025-12-18
463,Proofs of God: Classical Arguments from Tertullian to Barth,Books,54.21,One,In stock,,https://books.toscrape.com/catalogue/proofs-of-god-classical-arguments-from-tertullian-to-barth_538/index.html,2025-12-18
464,Please Kill Me: The Uncensored Oral History of Punk,Books,31.19,Four,In stock,,https://books.toscrape.com/catalogue/please-kill-me-the-uncensored-oral-history-of-punk_537/index.html,2025-12-18
465,Out of Print: City Lights Spotlight No. 14,Books,53.64,Five,In stock,,https://books.toscrape.com/catalogue/out-of-print-city-lights-spotlight-no-14_536/index.html,2025-12-18
466,My Life Next Door (My Life Next Door ),Books,36.39,Five,In stock,,https://books.toscrape.com/catalogue/my-life-next-door-my-life-next-door_535/index.html,2025-12-18
467,Miller's Valley,Books,58.54,Two,In stock,,https://books.toscrape.com/catalogue/millers-valley_534/index.html,2025-12-18
468,Man's Search for Meaning,Books,29.48,Three,In stock,,https://books.toscrape.com/catalogue/mans-search-for-meaning_533/index.html,2025-12-18
469,"Love That Boy: What Two Presidents, Eight Road Trips, and My Son Taught Me About a Parent's Expectations",Books,25.06,Two,In stock,,https://books.toscrape.com/catalogue/love-that-boy-what-two-presidents-eight-road-trips-and-my-son-taught-me-about-a-parents-expectations_532/index.html,2025-12-18
470,Living Forward: A Proven Plan to Stop Drifting and Get the Life You Want,Books,12.55,Three,In stock,,https://books.toscrape.com/catalogue/living-forward-a-proven-plan-to-stop-drifting-and-get-the-life-you-want_531/index.html,2025-12-18
471,Les Fleurs du Mal,Books,29.04,Five,In stock,,https://books.toscrape.com/catalogue/les-fleurs-du-mal_530/index.html,2025-12-18
472,Left Behind (Left Behind #1),Books,40.72,Two,In stock,,https://books.toscrape.com/catalogue/left-behind-left-behind-1_529/index.html,2025-12-18
473,Kill 'Em and Leave: Searching for James Brown and the American Soul,Books,45.05,Five,In stock,,https://books.toscrape.com/catalogue/kill-em-and-leave-searching-for-james-brown-and-the-american-soul_528/index.html,2025-12-18
474,Kierkegaard: A Christian Missionary to Christians,Books,47.13,One,In stock,,https://books.toscrape.com/catalogue/kierkegaard-a-christian-missionary-to-christians_527/index.html,2025-12-18
475,John Vassos: Industrial Design for Modern Life,Books,20.22,Four,In stock,,https://books.toscrape.com/catalogue/john-vassos-industrial-design-for-modern-life_526/index.html,2025-12-18
476,I'll Give You the Sun,Books,56.48,One,In stock,,https://books.toscrape.com/catalogue/ill-give-you-the-sun_525/index.html,2025-12-18
477,I Will Find You,Books,44.21,One,In stock,,https://books.toscrape.com/catalogue/i-will-find-you_524/index.html,2025-12-18
478,Hystopia: A Novel,Books,21.96,Four,In stock,,https://books.toscrape.com/catalogue/hystopia-a-novel_523/index.html,2025-12-18
479,Howl and Other Poems,Books,40.45,Two,In stock,,https://books.toscrape.com/catalogue/howl-and-other-poems_522/index.html,2025-12-18
480,History of Beauty,Books,10.29,Four,In stock,,https://books.toscrape.com/catalogue/history-of-beauty_521/index.html,2025-12-18
481,Heaven is for Real: A Little Boy's Astounding Story of His Trip to Heaven and Back,Books,52.86,Two,In stock,,https://books.toscrape.com/catalogue/heaven-is-for-real-a-little-boys-astounding-story-of-his-trip-to-heaven-and-back_520/index.html,2025-12-18
482,Future Shock (Future Shock #1),Books,55.65,Five,In stock,,https://books.toscrape.com/catalogue/future-shock-future-shock-1_519/index.html,2025-12-18
483,Ender's Game (The Ender Quintet #1),Books,43.64,One,In stock,,https://books.toscrape.com/catalogue/enders-game-the-ender-quintet-1_518/index.html,2025-12-18
484,Diary of a Citizen Scientist: Chasing Tiger Beetles and Other New Ways of Engaging the World,Books,28.41,One,In stock,,https://books.toscrape.com/catalogue/diary-of-a-citizen-scientist-chasing-tiger-beetles-and-other-new-ways-of-engaging-the-world_517/index.html,2025-12-18
485,Death by Leisure: A Cautionary Tale,Books,37.51,Four,In stock,,https://books.toscrape.com/catalogue/death-by-leisure-a-cautionary-tale_516/index.html,2025-12-18
486,Brilliant Beacons: A History of the American Lighthouse,Books,11.45,Three,In stock,,https://books.toscrape.com/catalogue/brilliant-beacons-a-history-of-the-american-lighthouse_515/index.html,2025-12-18
487,Brazen: The Courage to Find the You That's Been Hiding,Books,19.22,Two,In stock,,https://books.toscrape.com/catalogue/brazen-the-courage-to-find-the-you-thats-been-hiding_514/index.html,2025-12-18
488,Between the World and Me,Books,56.91,Four,In stock,,https://books.toscrape.com/catalogue/between-the-world-and-me_513/index.html,2025-12-18
489,Being Mortal: Medicine and What Matters in the End,Books,55.06,Four,In stock,,https://books.toscrape.com/catalogue/being-mortal-medicine-and-what-matters-in-the-end_512/index.html,2025-12-18
490,"A Murder Over a Girl: Justice, Gender, Junior High",Books,13.2,Three,In stock,,https://books.toscrape.com/catalogue/a-murder-over-a-girl-justice-gender-junior-high_511/index.html,2025-12-18
491,32 Yolks,Books,53.63,Two,In stock,,https://books.toscrape.com/catalogue/32-yolks_510/index.html,2025-12-18
492,"""Most Blessed of the Patriarchs"": Thomas Jefferson and the Empire of the Imagination",Books,44.48,Five,In stock,,https://books.toscrape.com/catalogue/most-blessed-of-the-patriarchs-thomas-jefferson-and-the-empire-of-the-imagination_509/index.html,2025-12-18
493,You Are a Badass: How to Stop Doubting Your Greatness and Start Living an Awesome Life,Books,12.08,Three,In stock,,https://books.toscrape.com/catalogue/you-are-a-badass-how-to-stop-doubting-your-greatness-and-start-living-an-awesome-life_508/index.html,2025-12-18
494,Wildlife of New York: A Five-Borough Coloring Book,Books,22.14,Two,In stock,,https://books.toscrape.com/catalogue/wildlife-of-new-york-a-five-borough-coloring-book_507/index.html,2025-12-18
495,What Happened on Beale Street (Secrets of the South Mysteries #2),Books,25.37,Five,In stock,,https://books.toscrape.com/catalogue/what-happened-on-beale-street-secrets-of-the-south-mysteries-2_506/index.html,2025-12-18
496,Unreasonable Hope: Finding Faith in the God Who Brings Purpose to Your Pain,Books,46.33,Two,In stock,,https://books.toscrape.com/catalogue/unreasonable-hope-finding-faith-in-the-god-who-brings-purpose-to-your-pain_505/index.html,2025-12-18
497,Under the Tuscan Sun,Books,37.33,Three,In stock,,https://books.toscrape.com/catalogue/under-the-tuscan-sun_504/index.html,2025-12-18
498,Toddlers Are A**holes: It's Not Your Fault,Books,25.55,One,In stock,,https://books.toscrape.com/catalogue/toddlers-are-aholes-its-not-your-fault_503/index.html,2025-12-18
499,The Year of Living Biblically: One Man's Humble Quest to Follow the Bible as Literally as Possible,Books,34.72,One,In stock,,https://books.toscrape.com/catalogue/the-year-of-living-biblically-one-mans-humble-quest-to-follow-the-bible-as-literally-as-possible_502/index.html,2025-12-18
500,The Whale,Books,35.96,Four,In stock,,https://books.toscrape.com/catalogue/the-whale_501/index.html,2025-12-18
501,The Story of Art,Books,41.14,Four,In stock,,https://books.toscrape.com/catalogue/the-story-of-art_500/index.html,2025-12-18
502,The Origin of Species,Books,10.01,Four,In stock,,https://books.toscrape.com/catalogue/the-origin-of-species_499/index.html,2025-12-18
503,The Great Gatsby,Books,36.05,Four,In stock,,https://books.toscrape.com/catalogue/the-great-gatsby_498/index.html,2025-12-18
504,The Good Girl,Books,49.03,Three,In stock,,https://books.toscrape.com/catalogue/the-good-girl_497/index.html,2025-12-18
505,The Glass Castle,Books,16.24,One,In stock,,https://books.toscrape.com/catalogue/the-glass-castle_496/index.html,2025-12-18
506,The Faith of Christopher Hitchens: The Restless Soul of the World's Most Notorious Atheist,Books,39.55,One,In stock,,https://books.toscrape.com/catalogue/the-faith-of-christopher-hitchens-the-restless-soul-of-the-worlds-most-notorious-atheist_495/index.html,2025-12-18
507,The Drowning Girls,Books,35.67,Three,In stock,,https://books.toscrape.com/catalogue/the-drowning-girls_494/index.html,2025-12-18
508,The Constant Princess (The Tudor Court #1),Books,16.62,Three,In stock,,https://books.toscrape.com/catalogue/the-constant-princess-the-tudor-court-1_493/index.html,2025-12-18
509,The Bourne Identity (Jason Bourne #1),Books,42.78,Four,In stock,,https://books.toscrape.com/catalogue/the-bourne-identity-jason-bourne-1_492/index.html,2025-12-18
510,The Bachelor Girl's Guide to Murder (Herringford and Watts Mysteries #1),Books,52.3,Five,In stock,,https://books.toscrape.com/catalogue/the-bachelor-girls-guide-to-murder-herringford-and-watts-mysteries-1_491/index.html,2025-12-18
511,The Art Book,Books,32.34,Two,In stock,,https://books.toscrape.com/catalogue/the-art-book_490/index.html,2025-12-18
512,The 7 Habits of Highly Effective People: Powerful Lessons in Personal Change,Books,33.17,Four,In stock,,https://books.toscrape.com/catalogue/the-7-habits-of-highly-effective-people-powerful-lessons-in-personal-change_489/index.html,2025-12-18
513,Team of Rivals: The Political Genius of Abraham Lincoln,Books,20.12,Five,In stock,,https://books.toscrape.com/catalogue/team-of-rivals-the-political-genius-of-abraham-lincoln_488/index.html,2025-12-18
514,Steal Like an Artist: 10 Things Nobody Told You About Being Creative,Books,20.9,Two,In stock,,https://books.toscrape.com/catalogue/steal-like-an-artist-10-things-nobody-told-you-about-being-creative_487/index.html,2025-12-18
515,"Sit, Stay, Love",Books,20.9,Three,In stock,,https://books.toscrape.com/catalogue/sit-stay-love_486/index.html,2025-12-18
516,Sister Dear,Books,40.2,Four,In stock,,https://books.toscrape.com/catalogue/sister-dear_485/index.html,2025-12-18
517,"Shrunken Treasures: Literary Classics, Short, Sweet, and Silly",Books,52.87,Three,In stock,,https://books.toscrape.com/catalogue/shrunken-treasures-literary-classics-short-sweet-and-silly_484/index.html,2025-12-18
518,"Rich Dad, Poor Dad",Books,51.74,One,In stock,,https://books.toscrape.com/catalogue/rich-dad-poor-dad_483/index.html,2025-12-18
519,Raymie Nightingale,Books,34.41,Two,In stock,,https://books.toscrape.com/catalogue/raymie-nightingale_482/index.html,2025-12-18
520,Playing from the Heart,Books,32.38,One,In stock,,https://books.toscrape.com/catalogue/playing-from-the-heart_481/index.html,2025-12-18
521,Nightstruck: A Novel,Books,50.35,Four,In stock,,https://books.toscrape.com/catalogue/nightstruck-a-novel_480/index.html,2025-12-18
522,"Naturally Lean: 125 Nourishing Gluten-Free, Plant-Based Recipes--All Under 300 Calories",Books,11.38,Five,In stock,,https://books.toscrape.com/catalogue/naturally-lean-125-nourishing-gluten-free-plant-based-recipes-all-under-300-calories_479/index.html,2025-12-18
523,Meternity,Books,43.58,Three,In stock,,https://books.toscrape.com/catalogue/meternity_478/index.html,2025-12-18
524,Memoirs of a Geisha,Books,49.67,Three,In stock,,https://books.toscrape.com/catalogue/memoirs-of-a-geisha_477/index.html,2025-12-18
525,Like Never Before (Walker Family #2),Books,28.77,Two,In stock,,https://books.toscrape.com/catalogue/like-never-before-walker-family-2_476/index.html,2025-12-18
526,Life of Pi,Books,13.22,Four,In stock,,https://books.toscrape.com/catalogue/life-of-pi_475/index.html,2025-12-18
527,Leave This Song Behind: Teen Poetry at Its Best,Books,51.17,Five,In stock,,https://books.toscrape.com/catalogue/leave-this-song-behind-teen-poetry-at-its-best_474/index.html,2025-12-18
528,King's Folly (The Kinsman Chronicles #1),Books,39.61,Five,In stock,,https://books.toscrape.com/catalogue/kings-folly-the-kinsman-chronicles-1_473/index.html,2025-12-18
529,John Adams,Books,57.43,Four,In stock,,https://books.toscrape.com/catalogue/john-adams_472/index.html,2025-12-18
530,How to Cook Everything Vegetarian: Simple Meatless Recipes for Great Food (How to Cook Everything),Books,46.01,Four,In stock,,https://books.toscrape.com/catalogue/how-to-cook-everything-vegetarian-simple-meatless-recipes-for-great-food-how-to-cook-everything_471/index.html,2025-12-18
531,How to Be a Domestic Goddess: Baking and the Art of Comfort Cooking,Books,28.25,Two,In stock,,https://books.toscrape.com/catalogue/how-to-be-a-domestic-goddess-baking-and-the-art-of-comfort-cooking_470/index.html,2025-12-18
532,Good in Bed (Cannie Shapiro #1),Books,37.05,Five,In stock,,https://books.toscrape.com/catalogue/good-in-bed-cannie-shapiro-1_469/index.html,2025-12-18
533,"Fruits Basket, Vol. 7 (Fruits Basket #7)",Books,19.57,One,In stock,,https://books.toscrape.com/catalogue/fruits-basket-vol-7-fruits-basket-7_468/index.html,2025-12-18
534,For the Love: Fighting for Grace in a World of Impossible Standards,Books,45.13,Three,In stock,,https://books.toscrape.com/catalogue/for-the-love-fighting-for-grace-in-a-world-of-impossible-standards_467/index.html,2025-12-18
535,Finding God in the Ruins: How God Redeems Pain,Books,46.64,Two,In stock,,https://books.toscrape.com/catalogue/finding-god-in-the-ruins-how-god-redeems-pain_466/index.html,2025-12-18
536,Every Heart a Doorway (Every Heart A Doorway #1),Books,12.16,Five,In stock,,https://books.toscrape.com/catalogue/every-heart-a-doorway-every-heart-a-doorway-1_465/index.html,2025-12-18
537,Delivering the Truth (Quaker Midwife Mystery #1),Books,20.89,Four,In stock,,https://books.toscrape.com/catalogue/delivering-the-truth-quaker-midwife-mystery-1_464/index.html,2025-12-18
538,Counted With the Stars (Out from Egypt #1),Books,17.97,Five,In stock,,https://books.toscrape.com/catalogue/counted-with-the-stars-out-from-egypt-1_463/index.html,2025-12-18
539,"Chronicles, Vol. 1",Books,52.6,Two,In stock,,https://books.toscrape.com/catalogue/chronicles-vol-1_462/index.html,2025-12-18
540,Blue Like Jazz: Nonreligious Thoughts on Christian Spirituality,Books,25.77,One,In stock,,https://books.toscrape.com/catalogue/blue-like-jazz-nonreligious-thoughts-on-christian-spirituality_461/index.html,2025-12-18
541,Benjamin Franklin: An American Life,Books,48.19,Three,In stock,,https://books.toscrape.com/catalogue/benjamin-franklin-an-american-life_460/index.html,2025-12-18
542,"At The Existentialist Café: Freedom, Being, and apricot cocktails with: Jean-Paul Sartre, Simone de Beauvoir, Albert Camus, Martin Heidegger, Edmund Husserl, Karl Jaspers, Maurice Merleau-Ponty and others",Books,29.93,Five,In stock,,https://books.toscrape.com/catalogue/at-the-existentialist-cafe-freedom-being-and-apricot-cocktails-with-jean-paul-sartre-simone-de-beauvoir-albert-camus-martin-heidegger-edmund-husserl-karl-jaspers-maurice-merleau-ponty-and-others_459/index.html,2025-12-18
543,A Summer In Europe,Books,44.34,Two,In stock,,https://books.toscrape.com/catalogue/a-summer-in-europe_458/index.html,2025-12-18
544,A Short History of Nearly Everything,Books,52.4,Five,In stock,,https://books.toscrape.com/catalogue/a-short-history-of-nearly-everything_457/index.html,2025-12-18
545,A Gathering of Shadows (Shades of Magic #2),Books,44.81,Four,In stock,,https://books.toscrape.com/catalogue/a-gathering-of-shadows-shades-of-magic-2_456/index.html,2025-12-18
546,The Sound Of Love,Books,57.84,Five,In stock,,https://books.toscrape.com/catalogue/the-sound-of-love_455/index.html,2025-12-18
547,The Rise and Fall of the Third Reich: A History of Nazi Germany,Books,39.67,Two,In stock,,https://books.toscrape.com/catalogue/the-rise-and-fall-of-the-third-reich-a-history-of-nazi-germany_454/index.html,2025-12-18
548,The Perks of Being a Wallflower,Books,55.02,Three,In stock,,https://books.toscrape.com/catalogue/the-perks-of-being-a-wallflower_453/index.html,2025-12-18
549,The Mysterious Affair at Styles (Hercule Poirot #1),Books,24.8,Four,In stock,,https://books.toscrape.com/catalogue/the-mysterious-affair-at-styles-hercule-poirot-1_452/index.html,2025-12-18
550,The Man Who Mistook His Wife for a Hat and Other Clinical Tales,Books,59.45,Four,In stock,,https://books.toscrape.com/catalogue/the-man-who-mistook-his-wife-for-a-hat-and-other-clinical-tales_451/index.html,2025-12-18
551,The Makings of a Fatherless Child,Books,31.58,Two,In stock,,https://books.toscrape.com/catalogue/the-makings-of-a-fatherless-child_450/index.html,2025-12-18
552,The Joy of Cooking,Books,43.27,Four,In stock,,https://books.toscrape.com/catalogue/the-joy-of-cooking_449/index.html,2025-12-18
553,The Invention of Wings,Books,37.34,One,In stock,,https://books.toscrape.com/catalogue/the-invention-of-wings_448/index.html,2025-12-18
554,The Hobbit (Middle-Earth Universe),Books,17.8,Five,In stock,,https://books.toscrape.com/catalogue/the-hobbit-middle-earth-universe_447/index.html,2025-12-18
555,The Great Railway Bazaar,Books,30.54,One,In stock,,https://books.toscrape.com/catalogue/the-great-railway-bazaar_446/index.html,2025-12-18
556,The Golden Compass (His Dark Materials #1),Books,18.77,One,In stock,,https://books.toscrape.com/catalogue/the-golden-compass-his-dark-materials-1_445/index.html,2025-12-18
557,The God Delusion,Books,46.85,Three,In stock,,https://books.toscrape.com/catalogue/the-god-delusion_444/index.html,2025-12-18
558,The Girl You Left Behind (The Girl You Left Behind #1),Books,15.79,One,In stock,,https://books.toscrape.com/catalogue/the-girl-you-left-behind-the-girl-you-left-behind-1_443/index.html,2025-12-18
559,The Fellowship of the Ring (The Lord of the Rings #1),Books,10.27,Two,In stock,,https://books.toscrape.com/catalogue/the-fellowship-of-the-ring-the-lord-of-the-rings-1_442/index.html,2025-12-18
560,The Collected Poems of W.B. Yeats (The Collected Works of W.B. Yeats #1),Books,15.42,Five,In stock,,https://books.toscrape.com/catalogue/the-collected-poems-of-wb-yeats-the-collected-works-of-wb-yeats-1_441/index.html,2025-12-18
561,The Barefoot Contessa Cookbook,Books,59.92,Five,In stock,,https://books.toscrape.com/catalogue/the-barefoot-contessa-cookbook_440/index.html,2025-12-18
562,Tell the Wolves I'm Home,Books,50.96,Two,In stock,,https://books.toscrape.com/catalogue/tell-the-wolves-im-home_439/index.html,2025-12-18
563,Ship Leaves Harbor: Essays on Travel by a Recovering Journeyman,Books,30.6,Three,In stock,,https://books.toscrape.com/catalogue/ship-leaves-harbor-essays-on-travel-by-a-recovering-journeyman_438/index.html,2025-12-18
564,Pride and Prejudice,Books,19.27,Four,In stock,,https://books.toscrape.com/catalogue/pride-and-prejudice_437/index.html,2025-12-18
565,Musicophilia: Tales of Music and the Brain,Books,46.58,One,In stock,,https://books.toscrape.com/catalogue/musicophilia-tales-of-music-and-the-brain_436/index.html,2025-12-18
566,Mere Christianity,Books,48.51,Three,In stock,,https://books.toscrape.com/catalogue/mere-christianity_435/index.html,2025-12-18
567,Me Before You (Me Before You #1),Books,19.02,One,In stock,,https://books.toscrape.com/catalogue/me-before-you-me-before-you-1_434/index.html,2025-12-18
568,In the Woods (Dublin Murder Squad #1),Books,38.38,Two,In stock,,https://books.toscrape.com/catalogue/in-the-woods-dublin-murder-squad-1_433/index.html,2025-12-18
569,In Cold Blood,Books,49.98,Four,In stock,,https://books.toscrape.com/catalogue/in-cold-blood_432/index.html,2025-12-18
570,How to Stop Worrying and Start Living,Books,46.49,Five,In stock,,https://books.toscrape.com/catalogue/how-to-stop-worrying-and-start-living_431/index.html,2025-12-18
571,Give It Back,Books,18.32,Two,In stock,,https://books.toscrape.com/catalogue/give-it-back_430/index.html,2025-12-18
572,"Girl, Interrupted",Books,42.14,Three,In stock,,https://books.toscrape.com/catalogue/girl-interrupted_429/index.html,2025-12-18
573,Fun Home: A Family Tragicomic,Books,56.59,Four,In stock,,https://books.toscrape.com/catalogue/fun-home-a-family-tragicomic_428/index.html,2025-12-18
574,"Fruits Basket, Vol. 6 (Fruits Basket #6)",Books,20.96,Four,In stock,,https://books.toscrape.com/catalogue/fruits-basket-vol-6-fruits-basket-6_427/index.html,2025-12-18
575,Deception Point,Books,40.32,Four,In stock,,https://books.toscrape.com/catalogue/deception-point_426/index.html,2025-12-18
576,"Death Note, Vol. 6: Give-and-Take (Death Note #6)",Books,36.39,Three,In stock,,https://books.toscrape.com/catalogue/death-note-vol-6-give-and-take-death-note-6_425/index.html,2025-12-18
577,Catherine the Great: Portrait of a Woman,Books,58.55,Four,In stock,,https://books.toscrape.com/catalogue/catherine-the-great-portrait-of-a-woman_424/index.html,2025-12-18
578,Better Homes and Gardens New Cook Book,Books,39.61,Three,In stock,,https://books.toscrape.com/catalogue/better-homes-and-gardens-new-cook-book_423/index.html,2025-12-18
579,An Unquiet Mind: A Memoir of Moods and Madness,Books,21.3,Three,In stock,,https://books.toscrape.com/catalogue/an-unquiet-mind-a-memoir-of-moods-and-madness_422/index.html,2025-12-18
580,A Year in Provence (Provence #1),Books,56.88,Four,In stock,,https://books.toscrape.com/catalogue/a-year-in-provence-provence-1_421/index.html,2025-12-18
581,World Without End (The Pillars of the Earth #2),Books,32.97,Four,In stock,,https://books.toscrape.com/catalogue/world-without-end-the-pillars-of-the-earth-2_420/index.html,2025-12-18
582,"Will Grayson, Will Grayson (Will Grayson, Will Grayson)",Books,47.31,Four,In stock,,https://books.toscrape.com/catalogue/will-grayson-will-grayson-will-grayson-will-grayson_419/index.html,2025-12-18
583,Why Save the Bankers?: And Other Essays on Our Economic and Political Crisis,Books,48.67,Two,In stock,,https://books.toscrape.com/catalogue/why-save-the-bankers-and-other-essays-on-our-economic-and-political-crisis_418/index.html,2025-12-18
